<anim ver="netanim-3.106" filetype="animation" >
<node id="0" sysId="0" locX="2.2" locY="30" />
<node id="1" sysId="0" locX="3.8" locY="30" />
<node id="2" sysId="0" locX="5.2" locY="30" />
<node id="3" sysId="0" locX="6.8" locY="30" />
<node id="4" sysId="0" locX="11.2" locY="30" />
<node id="5" sysId="0" locX="12.8" locY="30" />
<node id="6" sysId="0" locX="14.2" locY="30" />
<node id="7" sysId="0" locX="15.8" locY="30" />
<node id="8" sysId="0" locX="20.2" locY="30" />
<node id="9" sysId="0" locX="21.8" locY="30" />
<node id="10" sysId="0" locX="23.2" locY="30" />
<node id="11" sysId="0" locX="24.8" locY="30" />
<node id="12" sysId="0" locX="29.2" locY="30" />
<node id="13" sysId="0" locX="30.8" locY="30" />
<node id="14" sysId="0" locX="32.2" locY="30" />
<node id="15" sysId="0" locX="33.8" locY="30" />
<node id="16" sysId="0" locX="3" locY="25" />
<node id="17" sysId="0" locX="6" locY="25" />
<node id="18" sysId="0" locX="12" locY="25" />
<node id="19" sysId="0" locX="15" locY="25" />
<node id="20" sysId="0" locX="21" locY="25" />
<node id="21" sysId="0" locX="24" locY="25" />
<node id="22" sysId="0" locX="30" locY="25" />
<node id="23" sysId="0" locX="33" locY="25" />
<node id="24" sysId="0" locX="3" locY="19.5" />
<node id="25" sysId="0" locX="6" locY="19.5" />
<node id="26" sysId="0" locX="12" locY="19.5" />
<node id="27" sysId="0" locX="15" locY="19.5" />
<node id="28" sysId="0" locX="21" locY="19.5" />
<node id="29" sysId="0" locX="24" locY="19.5" />
<node id="30" sysId="0" locX="30" locY="19.5" />
<node id="31" sysId="0" locX="33" locY="19.5" />
<node id="32" sysId="0" locX="6" locY="10" />
<node id="33" sysId="0" locX="14" locY="10" />
<node id="34" sysId="0" locX="22" locY="10" />
<node id="35" sysId="0" locX="30" locY="10" />
<nu p="c" t="0" id="0" r="255" g="0" b="0" />
<nu p="c" t="0" id="1" r="255" g="0" b="0" />
<nu p="c" t="0" id="2" r="255" g="0" b="0" />
<nu p="c" t="0" id="3" r="255" g="0" b="0" />
<nu p="c" t="0" id="4" r="255" g="0" b="0" />
<nu p="c" t="0" id="5" r="255" g="0" b="0" />
<nu p="c" t="0" id="6" r="255" g="0" b="0" />
<nu p="c" t="0" id="7" r="255" g="0" b="0" />
<nu p="c" t="0" id="8" r="255" g="0" b="0" />
<nu p="c" t="0" id="9" r="255" g="0" b="0" />
<nu p="c" t="0" id="10" r="255" g="0" b="0" />
<nu p="c" t="0" id="11" r="255" g="0" b="0" />
<nu p="c" t="0" id="12" r="255" g="0" b="0" />
<nu p="c" t="0" id="13" r="255" g="0" b="0" />
<nu p="c" t="0" id="14" r="255" g="0" b="0" />
<nu p="c" t="0" id="15" r="255" g="0" b="0" />
<nu p="c" t="0" id="16" r="255" g="0" b="0" />
<nu p="c" t="0" id="17" r="255" g="0" b="0" />
<nu p="c" t="0" id="18" r="255" g="0" b="0" />
<nu p="c" t="0" id="19" r="255" g="0" b="0" />
<nu p="c" t="0" id="20" r="255" g="0" b="0" />
<nu p="c" t="0" id="21" r="255" g="0" b="0" />
<nu p="c" t="0" id="22" r="255" g="0" b="0" />
<nu p="c" t="0" id="23" r="255" g="0" b="0" />
<nu p="c" t="0" id="24" r="255" g="0" b="0" />
<nu p="c" t="0" id="25" r="255" g="0" b="0" />
<nu p="c" t="0" id="26" r="255" g="0" b="0" />
<nu p="c" t="0" id="27" r="255" g="0" b="0" />
<nu p="c" t="0" id="28" r="255" g="0" b="0" />
<nu p="c" t="0" id="29" r="255" g="0" b="0" />
<nu p="c" t="0" id="30" r="255" g="0" b="0" />
<nu p="c" t="0" id="31" r="255" g="0" b="0" />
<nu p="c" t="0" id="32" r="255" g="0" b="0" />
<nu p="c" t="0" id="33" r="255" g="0" b="0" />
<nu p="c" t="0" id="34" r="255" g="0" b="0" />
<nu p="c" t="0" id="35" r="255" g="0" b="0" />
<link fromId="0" toId="16" fd="10.0.17.1~00:00:00:00:00:01" td="10.0.17.2~00:00:00:00:00:02" ld="" />
<link fromId="1" toId="16" fd="10.0.14.1~00:00:00:00:00:03" td="10.0.14.2~00:00:00:00:00:04" ld="" />
<link fromId="2" toId="17" fd="10.0.19.1~00:00:00:00:00:09" td="10.0.19.2~00:00:00:00:00:0a" ld="" />
<link fromId="3" toId="17" fd="10.0.21.1~00:00:00:00:00:0b" td="10.0.21.2~00:00:00:00:00:0c" ld="" />
<link fromId="4" toId="18" fd="10.0.24.1~00:00:00:00:00:19" td="10.0.24.2~00:00:00:00:00:1a" ld="" />
<link fromId="5" toId="18" fd="10.0.7.1~00:00:00:00:00:1b" td="10.0.7.2~00:00:00:00:00:1c" ld="" />
<link fromId="6" toId="19" fd="10.0.33.1~00:00:00:00:00:21" td="10.0.33.2~00:00:00:00:00:22" ld="" />
<link fromId="7" toId="19" fd="10.0.12.1~00:00:00:00:00:23" td="10.0.12.2~00:00:00:00:00:24" ld="" />
<link fromId="8" toId="20" fd="10.0.32.1~00:00:00:00:00:31" td="10.0.32.2~00:00:00:00:00:32" ld="" />
<link fromId="9" toId="20" fd="10.0.18.1~00:00:00:00:00:33" td="10.0.18.2~00:00:00:00:00:34" ld="" />
<link fromId="10" toId="21" fd="10.0.35.1~00:00:00:00:00:39" td="10.0.35.2~00:00:00:00:00:3a" ld="" />
<link fromId="11" toId="21" fd="10.0.13.1~00:00:00:00:00:3b" td="10.0.13.2~00:00:00:00:00:3c" ld="" />
<link fromId="12" toId="22" fd="10.0.44.1~00:00:00:00:00:49" td="10.0.44.2~00:00:00:00:00:4a" ld="" />
<link fromId="13" toId="22" fd="10.0.37.1~00:00:00:00:00:4b" td="10.0.37.2~00:00:00:00:00:4c" ld="" />
<link fromId="14" toId="23" fd="10.0.31.1~00:00:00:00:00:51" td="10.0.31.2~00:00:00:00:00:52" ld="" />
<link fromId="15" toId="23" fd="10.0.45.1~00:00:00:00:00:53" td="10.0.45.2~00:00:00:00:00:54" ld="" />
<link fromId="16" toId="24" fd="10.0.29.1~00:00:00:00:00:05" td="10.0.29.2~00:00:00:00:00:06" ld="" />
<link fromId="16" toId="25" fd="10.0.40.1~00:00:00:00:00:07" td="10.0.40.2~00:00:00:00:00:08" ld="" />
<link fromId="17" toId="24" fd="10.0.9.1~00:00:00:00:00:0d" td="10.0.9.2~00:00:00:00:00:0e" ld="" />
<link fromId="17" toId="25" fd="10.0.27.1~00:00:00:00:00:0f" td="10.0.27.2~00:00:00:00:00:10" ld="" />
<link fromId="18" toId="26" fd="10.0.22.1~00:00:00:00:00:1d" td="10.0.22.2~00:00:00:00:00:1e" ld="" />
<link fromId="18" toId="27" fd="10.0.15.1~00:00:00:00:00:1f" td="10.0.15.2~00:00:00:00:00:20" ld="" />
<link fromId="19" toId="26" fd="10.0.47.1~00:00:00:00:00:25" td="10.0.47.2~00:00:00:00:00:26" ld="" />
<link fromId="19" toId="27" fd="10.0.6.1~00:00:00:00:00:27" td="10.0.6.2~00:00:00:00:00:28" ld="" />
<link fromId="20" toId="28" fd="10.0.34.1~00:00:00:00:00:35" td="10.0.34.2~00:00:00:00:00:36" ld="" />
<link fromId="20" toId="29" fd="10.0.36.1~00:00:00:00:00:37" td="10.0.36.2~00:00:00:00:00:38" ld="" />
<link fromId="21" toId="28" fd="10.0.38.1~00:00:00:00:00:3d" td="10.0.38.2~00:00:00:00:00:3e" ld="" />
<link fromId="21" toId="29" fd="10.0.10.1~00:00:00:00:00:3f" td="10.0.10.2~00:00:00:00:00:40" ld="" />
<link fromId="22" toId="30" fd="10.0.42.1~00:00:00:00:00:4d" td="10.0.42.2~00:00:00:00:00:4e" ld="" />
<link fromId="22" toId="31" fd="10.0.43.1~00:00:00:00:00:4f" td="10.0.43.2~00:00:00:00:00:50" ld="" />
<link fromId="23" toId="30" fd="10.0.48.1~00:00:00:00:00:55" td="10.0.48.2~00:00:00:00:00:56" ld="" />
<link fromId="23" toId="31" fd="10.0.16.1~00:00:00:00:00:57" td="10.0.16.2~00:00:00:00:00:58" ld="" />
<link fromId="24" toId="32" fd="10.0.28.1~00:00:00:00:00:11" td="10.0.28.2~00:00:00:00:00:12" ld="" />
<link fromId="24" toId="33" fd="10.0.23.1~00:00:00:00:00:13" td="10.0.23.2~00:00:00:00:00:14" ld="" />
<link fromId="25" toId="34" fd="10.0.26.1~00:00:00:00:00:15" td="10.0.26.2~00:00:00:00:00:16" ld="" />
<link fromId="25" toId="35" fd="10.0.5.1~00:00:00:00:00:17" td="10.0.5.2~00:00:00:00:00:18" ld="" />
<link fromId="26" toId="32" fd="10.0.4.1~00:00:00:00:00:29" td="10.0.4.2~00:00:00:00:00:2a" ld="" />
<link fromId="26" toId="33" fd="10.0.3.1~00:00:00:00:00:2b" td="10.0.3.2~00:00:00:00:00:2c" ld="" />
<link fromId="27" toId="34" fd="10.0.8.1~00:00:00:00:00:2d" td="10.0.8.2~00:00:00:00:00:2e" ld="" />
<link fromId="27" toId="35" fd="10.0.30.1~00:00:00:00:00:2f" td="10.0.30.2~00:00:00:00:00:30" ld="" />
<link fromId="28" toId="32" fd="10.0.11.1~00:00:00:00:00:41" td="10.0.11.2~00:00:00:00:00:42" ld="" />
<link fromId="28" toId="33" fd="10.0.25.1~00:00:00:00:00:43" td="10.0.25.2~00:00:00:00:00:44" ld="" />
<link fromId="29" toId="34" fd="10.0.39.1~00:00:00:00:00:45" td="10.0.39.2~00:00:00:00:00:46" ld="" />
<link fromId="29" toId="35" fd="10.0.41.1~00:00:00:00:00:47" td="10.0.41.2~00:00:00:00:00:48" ld="" />
<link fromId="30" toId="32" fd="10.0.46.1~00:00:00:00:00:59" td="10.0.46.2~00:00:00:00:00:5a" ld="" />
<link fromId="30" toId="33" fd="10.0.20.1~00:00:00:00:00:5b" td="10.0.20.2~00:00:00:00:00:5c" ld="" />
<link fromId="31" toId="34" fd="10.0.2.1~00:00:00:00:00:5d" td="10.0.2.2~00:00:00:00:00:5e" ld="" />
<link fromId="31" toId="35" fd="10.0.1.1~00:00:00:00:00:5f" td="10.0.1.2~00:00:00:00:00:60" ld="" />
<nu p="s" t="0" id="0" w="1" h="1" />
<nu p="s" t="0" id="1" w="1" h="1" />
<nu p="s" t="0" id="2" w="1" h="1" />
<nu p="s" t="0" id="3" w="1" h="1" />
<nu p="s" t="0" id="4" w="1" h="1" />
<nu p="s" t="0" id="5" w="1" h="1" />
<nu p="s" t="0" id="6" w="1" h="1" />
<nu p="s" t="0" id="7" w="1" h="1" />
<nu p="s" t="0" id="8" w="1" h="1" />
<nu p="s" t="0" id="9" w="1" h="1" />
<nu p="s" t="0" id="10" w="1" h="1" />
<nu p="s" t="0" id="11" w="1" h="1" />
<nu p="s" t="0" id="12" w="1" h="1" />
<nu p="s" t="0" id="13" w="1" h="1" />
<nu p="s" t="0" id="14" w="1" h="1" />
<nu p="s" t="0" id="15" w="1" h="1" />
<nu p="s" t="0" id="16" w="1" h="1" />
<nu p="s" t="0" id="17" w="1" h="1" />
<nu p="s" t="0" id="18" w="1" h="1" />
<nu p="s" t="0" id="19" w="1" h="1" />
<nu p="s" t="0" id="20" w="1" h="1" />
<nu p="s" t="0" id="21" w="1" h="1" />
<nu p="s" t="0" id="22" w="1" h="1" />
<nu p="s" t="0" id="23" w="1" h="1" />
<nu p="s" t="0" id="24" w="1" h="1" />
<nu p="s" t="0" id="25" w="1" h="1" />
<nu p="s" t="0" id="26" w="1" h="1" />
<nu p="s" t="0" id="27" w="1" h="1" />
<nu p="s" t="0" id="28" w="1" h="1" />
<nu p="s" t="0" id="29" w="1" h="1" />
<nu p="s" t="0" id="30" w="1" h="1" />
<nu p="s" t="0" id="31" w="1" h="1" />
<nu p="s" t="0" id="32" w="1" h="1" />
<nu p="s" t="0" id="33" w="1" h="1" />
<nu p="s" t="0" id="34" w="1" h="1" />
<nu p="s" t="0" id="35" w="1" h="1" />
<ncs ncId="0" n="RemainingEnergy" t="DOUBLE" />
<nu p="c" t="0" id="0" r="0" g="0" b="255" />
<nu p="s" t="0" id="0" w="0.5" h="0.5" />
<nu p="c" t="0" id="1" r="0" g="0" b="255" />
<nu p="s" t="0" id="1" w="0.5" h="0.5" />
<nu p="c" t="0" id="2" r="0" g="0" b="255" />
<nu p="s" t="0" id="2" w="0.5" h="0.5" />
<nu p="c" t="0" id="3" r="0" g="0" b="255" />
<nu p="s" t="0" id="3" w="0.5" h="0.5" />
<nu p="c" t="0" id="4" r="0" g="0" b="255" />
<nu p="s" t="0" id="4" w="0.5" h="0.5" />
<nu p="c" t="0" id="5" r="0" g="0" b="255" />
<nu p="s" t="0" id="5" w="0.5" h="0.5" />
<nu p="c" t="0" id="6" r="0" g="0" b="255" />
<nu p="s" t="0" id="6" w="0.5" h="0.5" />
<nu p="c" t="0" id="7" r="0" g="0" b="255" />
<nu p="s" t="0" id="7" w="0.5" h="0.5" />
<nu p="c" t="0" id="8" r="0" g="0" b="255" />
<nu p="s" t="0" id="8" w="0.5" h="0.5" />
<nu p="c" t="0" id="9" r="0" g="0" b="255" />
<nu p="s" t="0" id="9" w="0.5" h="0.5" />
<nu p="c" t="0" id="10" r="0" g="0" b="255" />
<nu p="s" t="0" id="10" w="0.5" h="0.5" />
<nu p="c" t="0" id="11" r="0" g="0" b="255" />
<nu p="s" t="0" id="11" w="0.5" h="0.5" />
<nu p="c" t="0" id="12" r="0" g="0" b="255" />
<nu p="s" t="0" id="12" w="0.5" h="0.5" />
<nu p="c" t="0" id="13" r="0" g="0" b="255" />
<nu p="s" t="0" id="13" w="0.5" h="0.5" />
<nu p="c" t="0" id="14" r="0" g="0" b="255" />
<nu p="s" t="0" id="14" w="0.5" h="0.5" />
<nu p="c" t="0" id="15" r="0" g="0" b="255" />
<nu p="s" t="0" id="15" w="0.5" h="0.5" />
<nu p="c" t="0" id="16" r="0" g="200" b="0" />
<nu p="c" t="0" id="24" r="0" g="200" b="0" />
<nu p="c" t="0" id="17" r="0" g="200" b="0" />
<nu p="c" t="0" id="25" r="0" g="200" b="0" />
<nu p="c" t="0" id="18" r="0" g="200" b="0" />
<nu p="c" t="0" id="26" r="0" g="200" b="0" />
<nu p="c" t="0" id="19" r="0" g="200" b="0" />
<nu p="c" t="0" id="27" r="0" g="200" b="0" />
<nu p="c" t="0" id="20" r="0" g="200" b="0" />
<nu p="c" t="0" id="28" r="0" g="200" b="0" />
<nu p="c" t="0" id="21" r="0" g="200" b="0" />
<nu p="c" t="0" id="29" r="0" g="200" b="0" />
<nu p="c" t="0" id="22" r="0" g="200" b="0" />
<nu p="c" t="0" id="30" r="0" g="200" b="0" />
<nu p="c" t="0" id="23" r="0" g="200" b="0" />
<nu p="c" t="0" id="31" r="0" g="200" b="0" />
<nu p="c" t="0" id="32" r="255" g="0" b="0" />
<nu p="c" t="0" id="33" r="255" g="0" b="0" />
<nu p="c" t="0" id="34" r="255" g="0" b="0" />
<nu p="c" t="0" id="35" r="255" g="0" b="0" />
<p fId="0" fbTx="1" lbTx="1.000046399" meta-info="ns3::PppHeader (Point-to-Point Protocol: IP (0x0021)) ns3::Ipv4Header (tos 0x0 DSCP Default ECN Not-ECT ttl 64 id 0 protocol 6 offset (bytes) 0 flags [none] length: 56 10.0.17.1 &gt; 10.0.24.1) ns3::TcpHeader (49153 &gt; 7010 [SYN] Seq=0 Ack=0 Win=65535 ns3::TcpOptionTS(1000;0) ns3::TcpOptionWinScale(14) ns3::TcpOptionEnd(EOL))" tId="16" fbRx="1" lbRx="1.000046399" />
<p fId="16" fbTx="1.000046399" lbTx="1.000092798" meta-info="ns3::PppHeader (Point-to-Point Protocol: IP (0x0021)) ns3::Ipv4Header (tos 0x0 DSCP Default ECN Not-ECT ttl 63 id 0 protocol 6 offset (bytes) 0 flags [none] length: 56 10.0.17.1 &gt; 10.0.24.1) ns3::TcpHeader (49153 &gt; 7010 [SYN] Seq=0 Ack=0 Win=65535 ns3::TcpOptionTS(1000;0) ns3::TcpOptionWinScale(14) ns3::TcpOptionEnd(EOL))" tId="25" fbRx="1.000046399" lbRx="1.000092798" />
<p fId="25" fbTx="1.000092798" lbTx="1.000139197" meta-info="ns3::PppHeader (Point-to-Point Protocol: IP (0x0021)) ns3::Ipv4Header (tos 0x0 DSCP Default ECN Not-ECT ttl 62 id 0 protocol 6 offset (bytes) 0 flags [none] length: 56 10.0.17.1 &gt; 10.0.24.1) ns3::TcpHeader (49153 &gt; 7010 [SYN] Seq=0 Ack=0 Win=65535 ns3::TcpOptionTS(1000;0) ns3::TcpOptionWinScale(14) ns3::TcpOptionEnd(EOL))" tId="34" fbRx="1.000092798" lbRx="1.000139197" />
<p fId="34" fbTx="1.000139197" lbTx="1.000185596" meta-info="ns3::PppHeader (Point-to-Point Protocol: IP (0x0021)) ns3::Ipv4Header (tos 0x0 DSCP Default ECN Not-ECT ttl 61 id 0 protocol 6 offset (bytes) 0 flags [none] length: 56 10.0.17.1 &gt; 10.0.24.1) ns3::TcpHeader (49153 &gt; 7010 [SYN] Seq=0 Ack=0 Win=65535 ns3::TcpOptionTS(1000;0) ns3::TcpOptionWinScale(14) ns3::TcpOptionEnd(EOL))" tId="27" fbRx="1.000139197" lbRx="1.000185596" />
<p fId="27" fbTx="1.000185596" lbTx="1.000231995" meta-info="ns3::PppHeader (Point-to-Point Protocol: IP (0x0021)) ns3::Ipv4Header (tos 0x0 DSCP Default ECN Not-ECT ttl 60 id 0 protocol 6 offset (bytes) 0 flags [none] length: 56 10.0.17.1 &gt; 10.0.24.1) ns3::TcpHeader (49153 &gt; 7010 [SYN] Seq=0 Ack=0 Win=65535 ns3::TcpOptionTS(1000;0) ns3::TcpOptionWinScale(14) ns3::TcpOptionEnd(EOL))" tId="18" fbRx="1.000185596" lbRx="1.000231995" />
<p fId="18" fbTx="1.000231995" lbTx="1.000278394" meta-info="ns3::PppHeader (Point-to-Point Protocol: IP (0x0021)) ns3::Ipv4Header (tos 0x0 DSCP Default ECN Not-ECT ttl 59 id 0 protocol 6 offset (bytes) 0 flags [none] length: 56 10.0.17.1 &gt; 10.0.24.1) ns3::TcpHeader (49153 &gt; 7010 [SYN] Seq=0 Ack=0 Win=65535 ns3::TcpOptionTS(1000;0) ns3::TcpOptionWinScale(14) ns3::TcpOptionEnd(EOL))" tId="4" fbRx="1.000231995" lbRx="1.000278394" />
<p fId="4" fbTx="1.000278394" lbTx="1.000324793" meta-info="ns3::PppHeader (Point-to-Point Protocol: IP (0x0021)) ns3::Ipv4Header (tos 0x0 DSCP Default ECN Not-ECT ttl 64 id 0 protocol 6 offset (bytes) 0 flags [none] length: 56 10.0.24.1 &gt; 10.0.17.1) ns3::TcpHeader (7010 &gt; 49153 [SYN|ACK] Seq=0 Ack=1 Win=65535 ns3::TcpOptionTS(1000;1000) ns3::TcpOptionWinScale(14) ns3::TcpOptionEnd(EOL))" tId="18" fbRx="1.000278394" lbRx="1.000324793" />
<p fId="18" fbTx="1.000324793" lbTx="1.000371192" meta-info="ns3::PppHeader (Point-to-Point Protocol: IP (0x0021)) ns3::Ipv4Header (tos 0x0 DSCP Default ECN Not-ECT ttl 63 id 0 protocol 6 offset (bytes) 0 flags [none] length: 56 10.0.24.1 &gt; 10.0.17.1) ns3::TcpHeader (7010 &gt; 49153 [SYN|ACK] Seq=0 Ack=1 Win=65535 ns3::TcpOptionTS(1000;1000) ns3::TcpOptionWinScale(14) ns3::TcpOptionEnd(EOL))" tId="26" fbRx="1.000324793" lbRx="1.000371192" />
<p fId="26" fbTx="1.000371192" lbTx="1.000417591" meta-info="ns3::PppHeader (Point-to-Point Protocol: IP (0x0021)) ns3::Ipv4Header (tos 0x0 DSCP Default ECN Not-ECT ttl 62 id 0 protocol 6 offset (bytes) 0 flags [none] length: 56 10.0.24.1 &gt; 10.0.17.1) ns3::TcpHeader (7010 &gt; 49153 [SYN|ACK] Seq=0 Ack=1 Win=65535 ns3::TcpOptionTS(1000;1000) ns3::TcpOptionWinScale(14) ns3::TcpOptionEnd(EOL))" tId="32" fbRx="1.000371192" lbRx="1.000417591" />
<p fId="32" fbTx="1.000417591" lbTx="1.00046399" meta-info="ns3::PppHeader (Point-to-Point Protocol: IP (0x0021)) ns3::Ipv4Header (tos 0x0 DSCP Default ECN Not-ECT ttl 61 id 0 protocol 6 offset (bytes) 0 flags [none] length: 56 10.0.24.1 &gt; 10.0.17.1) ns3::TcpHeader (7010 &gt; 49153 [SYN|ACK] Seq=0 Ack=1 Win=65535 ns3::TcpOptionTS(1000;1000) ns3::TcpOptionWinScale(14) ns3::TcpOptionEnd(EOL))" tId="24" fbRx="1.000417591" lbRx="1.00046399" />
<p fId="24" fbTx="1.00046399" lbTx="1.000510389" meta-info="ns3::PppHeader (Point-to-Point Protocol: IP (0x0021)) ns3::Ipv4Header (tos 0x0 DSCP Default ECN Not-ECT ttl 60 id 0 protocol 6 offset (bytes) 0 flags [none] length: 56 10.0.24.1 &gt; 10.0.17.1) ns3::TcpHeader (7010 &gt; 49153 [SYN|ACK] Seq=0 Ack=1 Win=65535 ns3::TcpOptionTS(1000;1000) ns3::TcpOptionWinScale(14) ns3::TcpOptionEnd(EOL))" tId="16" fbRx="1.00046399" lbRx="1.000510389" />
<p fId="16" fbTx="1.000510389" lbTx="1.000556788" meta-info="ns3::PppHeader (Point-to-Point Protocol: IP (0x0021)) ns3::Ipv4Header (tos 0x0 DSCP Default ECN Not-ECT ttl 59 id 0 protocol 6 offset (bytes) 0 flags [none] length: 56 10.0.24.1 &gt; 10.0.17.1) ns3::TcpHeader (7010 &gt; 49153 [SYN|ACK] Seq=0 Ack=1 Win=65535 ns3::TcpOptionTS(1000;1000) ns3::TcpOptionWinScale(14) ns3::TcpOptionEnd(EOL))" tId="0" fbRx="1.000510389" lbRx="1.000556788" />
<p fId="0" fbTx="1.000556788" lbTx="1.000599988" meta-info="ns3::PppHeader (Point-to-Point Protocol: IP (0x0021)) ns3::Ipv4Header (tos 0x0 DSCP Default ECN Not-ECT ttl 64 id 1 protocol 6 offset (bytes) 0 flags [none] length: 52 10.0.17.1 &gt; 10.0.24.1) ns3::TcpHeader (49153 &gt; 7010 [ACK] Seq=1 Ack=1 Win=65535 ns3::TcpOptionTS(1000;1000) ns3::TcpOptionEnd(EOL))" tId="16" fbRx="1.000556788" lbRx="1.000599988" />
<p fId="0" fbTx="1.000599988" lbTx="1.001795187" meta-info="ns3::PppHeader (Point-to-Point Protocol: IP (0x0021)) ns3::Ipv4Header (tos 0x0 DSCP Default ECN Not-ECT ttl 64 id 2 protocol 6 offset (bytes) 0 flags [none] length: 1492 10.0.17.1 &gt; 10.0.24.1) ns3::TcpHeader (49153 &gt; 7010 [ACK] Seq=1 Ack=1 Win=65535 ns3::TcpOptionTS(1000;1000) ns3::TcpOptionEnd(EOL)) Payload (size=1440)" tId="16" fbRx="1.000599988" lbRx="1.001795187" />
<p fId="16" fbTx="1.000599988" lbTx="1.000643188" meta-info="ns3::PppHeader (Point-to-Point Protocol: IP (0x0021)) ns3::Ipv4Header (tos 0x0 DSCP Default ECN Not-ECT ttl 63 id 1 protocol 6 offset (bytes) 0 flags [none] length: 52 10.0.17.1 &gt; 10.0.24.1) ns3::TcpHeader (49153 &gt; 7010 [ACK] Seq=1 Ack=1 Win=65535 ns3::TcpOptionTS(1000;1000) ns3::TcpOptionEnd(EOL))" tId="25" fbRx="1.000599988" lbRx="1.000643188" />
<p fId="25" fbTx="1.000643188" lbTx="1.000686388" meta-info="ns3::PppHeader (Point-to-Point Protocol: IP (0x0021)) ns3::Ipv4Header (tos 0x0 DSCP Default ECN Not-ECT ttl 62 id 1 protocol 6 offset (bytes) 0 flags [none] length: 52 10.0.17.1 &gt; 10.0.24.1) ns3::TcpHeader (49153 &gt; 7010 [ACK] Seq=1 Ack=1 Win=65535 ns3::TcpOptionTS(1000;1000) ns3::TcpOptionEnd(EOL))" tId="34" fbRx="1.000643188" lbRx="1.000686388" />
<p fId="34" fbTx="1.000686388" lbTx="1.000729588" meta-info="ns3::PppHeader (Point-to-Point Protocol: IP (0x0021)) ns3::Ipv4Header (tos 0x0 DSCP Default ECN Not-ECT ttl 61 id 1 protocol 6 offset (bytes) 0 flags [none] length: 52 10.0.17.1 &gt; 10.0.24.1) ns3::TcpHeader (49153 &gt; 7010 [ACK] Seq=1 Ack=1 Win=65535 ns3::TcpOptionTS(1000;1000) ns3::TcpOptionEnd(EOL))" tId="27" fbRx="1.000686388" lbRx="1.000729588" />
<p fId="27" fbTx="1.000729588" lbTx="1.000772788" meta-info="ns3::PppHeader (Point-to-Point Protocol: IP (0x0021)) ns3::Ipv4Header (tos 0x0 DSCP Default ECN Not-ECT ttl 60 id 1 protocol 6 offset (bytes) 0 flags [none] length: 52 10.0.17.1 &gt; 10.0.24.1) ns3::TcpHeader (49153 &gt; 7010 [ACK] Seq=1 Ack=1 Win=65535 ns3::TcpOptionTS(1000;1000) ns3::TcpOptionEnd(EOL))" tId="18" fbRx="1.000729588" lbRx="1.000772788" />
<p fId="18" fbTx="1.000772788" lbTx="1.000815988" meta-info="ns3::PppHeader (Point-to-Point Protocol: IP (0x0021)) ns3::Ipv4Header (tos 0x0 DSCP Default ECN Not-ECT ttl 59 id 1 protocol 6 offset (bytes) 0 flags [none] length: 52 10.0.17.1 &gt; 10.0.24.1) ns3::TcpHeader (49153 &gt; 7010 [ACK] Seq=1 Ack=1 Win=65535 ns3::TcpOptionTS(1000;1000) ns3::TcpOptionEnd(EOL))" tId="4" fbRx="1.000772788" lbRx="1.000815988" />
<p fId="16" fbTx="1.001795187" lbTx="1.002990386" meta-info="ns3::PppHeader (Point-to-Point Protocol: IP (0x0021)) ns3::Ipv4Header (tos 0x0 DSCP Default ECN Not-ECT ttl 63 id 2 protocol 6 offset (bytes) 0 flags [none] length: 1492 10.0.17.1 &gt; 10.0.24.1) ns3::TcpHeader (49153 &gt; 7010 [ACK] Seq=1 Ack=1 Win=65535 ns3::TcpOptionTS(1000;1000) ns3::TcpOptionEnd(EOL)) Payload (size=1440)" tId="25" fbRx="1.001795187" lbRx="1.002990386" />
<p fId="25" fbTx="1.002990386" lbTx="1.004185585" meta-info="ns3::PppHeader (Point-to-Point Protocol: IP (0x0021)) ns3::Ipv4Header (tos 0x0 DSCP Default ECN Not-ECT ttl 62 id 2 protocol 6 offset (bytes) 0 flags [none] length: 1492 10.0.17.1 &gt; 10.0.24.1) ns3::TcpHeader (49153 &gt; 7010 [ACK] Seq=1 Ack=1 Win=65535 ns3::TcpOptionTS(1000;1000) ns3::TcpOptionEnd(EOL)) Payload (size=1440)" tId="34" fbRx="1.002990386" lbRx="1.004185585" />
<p fId="34" fbTx="1.004185585" lbTx="1.005380784" meta-info="ns3::PppHeader (Point-to-Point Protocol: IP (0x0021)) ns3::Ipv4Header (tos 0x0 DSCP Default ECN Not-ECT ttl 61 id 2 protocol 6 offset (bytes) 0 flags [none] length: 1492 10.0.17.1 &gt; 10.0.24.1) ns3::TcpHeader (49153 &gt; 7010 [ACK] Seq=1 Ack=1 Win=65535 ns3::TcpOptionTS(1000;1000) ns3::TcpOptionEnd(EOL)) Payload (size=1440)" tId="27" fbRx="1.004185585" lbRx="1.005380784" />
<p fId="27" fbTx="1.005380784" lbTx="1.006575983" meta-info="ns3::PppHeader (Point-to-Point Protocol: IP (0x0021)) ns3::Ipv4Header (tos 0x0 DSCP Default ECN Not-ECT ttl 60 id 2 protocol 6 offset (bytes) 0 flags [none] length: 1492 10.0.17.1 &gt; 10.0.24.1) ns3::TcpHeader (49153 &gt; 7010 [ACK] Seq=1 Ack=1 Win=65535 ns3::TcpOptionTS(1000;1000) ns3::TcpOptionEnd(EOL)) Payload (size=1440)" tId="18" fbRx="1.005380784" lbRx="1.006575983" />
<p fId="18" fbTx="1.006575983" lbTx="1.007771182" meta-info="ns3::PppHeader (Point-to-Point Protocol: IP (0x0021)) ns3::Ipv4Header (tos 0x0 DSCP Default ECN Not-ECT ttl 59 id 2 protocol 6 offset (bytes) 0 flags [none] length: 1492 10.0.17.1 &gt; 10.0.24.1) ns3::TcpHeader (49153 &gt; 7010 [ACK] Seq=1 Ack=1 Win=65535 ns3::TcpOptionTS(1000;1000) ns3::TcpOptionEnd(EOL)) Payload (size=1440)" tId="4" fbRx="1.006575983" lbRx="1.007771182" />
<p fId="4" fbTx="1.007771182" lbTx="1.007814382" meta-info="ns3::PppHeader (Point-to-Point Protocol: IP (0x0021)) ns3::Ipv4Header (tos 0x0 DSCP Default ECN Not-ECT ttl 64 id 1 protocol 6 offset (bytes) 0 flags [none] length: 52 10.0.24.1 &gt; 10.0.17.1) ns3::TcpHeader (7010 &gt; 49153 [ACK] Seq=1 Ack=1441 Win=65535 ns3::TcpOptionTS(1007;1000) ns3::TcpOptionEnd(EOL))" tId="18" fbRx="1.007771182" lbRx="1.007814382" />
<p fId="18" fbTx="1.007814382" lbTx="1.007857582" meta-info="ns3::PppHeader (Point-to-Point Protocol: IP (0x0021)) ns3::Ipv4Header (tos 0x0 DSCP Default ECN Not-ECT ttl 63 id 1 protocol 6 offset (bytes) 0 flags [none] length: 52 10.0.24.1 &gt; 10.0.17.1) ns3::TcpHeader (7010 &gt; 49153 [ACK] Seq=1 Ack=1441 Win=65535 ns3::TcpOptionTS(1007;1000) ns3::TcpOptionEnd(EOL))" tId="26" fbRx="1.007814382" lbRx="1.007857582" />
<p fId="26" fbTx="1.007857582" lbTx="1.007900782" meta-info="ns3::PppHeader (Point-to-Point Protocol: IP (0x0021)) ns3::Ipv4Header (tos 0x0 DSCP Default ECN Not-ECT ttl 62 id 1 protocol 6 offset (bytes) 0 flags [none] length: 52 10.0.24.1 &gt; 10.0.17.1) ns3::TcpHeader (7010 &gt; 49153 [ACK] Seq=1 Ack=1441 Win=65535 ns3::TcpOptionTS(1007;1000) ns3::TcpOptionEnd(EOL))" tId="32" fbRx="1.007857582" lbRx="1.007900782" />
<p fId="32" fbTx="1.007900782" lbTx="1.007943982" meta-info="ns3::PppHeader (Point-to-Point Protocol: IP (0x0021)) ns3::Ipv4Header (tos 0x0 DSCP Default ECN Not-ECT ttl 61 id 1 protocol 6 offset (bytes) 0 flags [none] length: 52 10.0.24.1 &gt; 10.0.17.1) ns3::TcpHeader (7010 &gt; 49153 [ACK] Seq=1 Ack=1441 Win=65535 ns3::TcpOptionTS(1007;1000) ns3::TcpOptionEnd(EOL))" tId="24" fbRx="1.007900782" lbRx="1.007943982" />
<p fId="24" fbTx="1.007943982" lbTx="1.007987182" meta-info="ns3::PppHeader (Point-to-Point Protocol: IP (0x0021)) ns3::Ipv4Header (tos 0x0 DSCP Default ECN Not-ECT ttl 60 id 1 protocol 6 offset (bytes) 0 flags [none] length: 52 10.0.24.1 &gt; 10.0.17.1) ns3::TcpHeader (7010 &gt; 49153 [ACK] Seq=1 Ack=1441 Win=65535 ns3::TcpOptionTS(1007;1000) ns3::TcpOptionEnd(EOL))" tId="16" fbRx="1.007943982" lbRx="1.007987182" />
<p fId="16" fbTx="1.007987182" lbTx="1.008030382" meta-info="ns3::PppHeader (Point-to-Point Protocol: IP (0x0021)) ns3::Ipv4Header (tos 0x0 DSCP Default ECN Not-ECT ttl 59 id 1 protocol 6 offset (bytes) 0 flags [none] length: 52 10.0.24.1 &gt; 10.0.17.1) ns3::TcpHeader (7010 &gt; 49153 [ACK] Seq=1 Ack=1441 Win=65535 ns3::TcpOptionTS(1007;1000) ns3::TcpOptionEnd(EOL))" tId="0" fbRx="1.007987182" lbRx="1.008030382" />
<p fId="0" fbTx="1.008030383" lbTx="1.009230382" meta-info="ns3::PppHeader (Point-to-Point Protocol: IP (0x0021)) ns3::Ipv4Header (tos 0x0 DSCP Default ECN Not-ECT ttl 64 id 3 protocol 6 offset (bytes) 0 flags [none] length: 1498 10.0.17.1 &gt; 10.0.24.1) ns3::TcpHeader (49153 &gt; 7010 [ACK] Seq=1441 Ack=1 Win=65535 ns3::TcpOptionTS(1008;1007) ns3::TcpOptionEnd(EOL)) Payload (size=1440) Payload Fragment [0:6]" tId="16" fbRx="1.008030383" lbRx="1.009230382" />
<p fId="16" fbTx="1.009230382" lbTx="1.010430381" meta-info="ns3::PppHeader (Point-to-Point Protocol: IP (0x0021)) ns3::Ipv4Header (tos 0x0 DSCP Default ECN Not-ECT ttl 63 id 3 protocol 6 offset (bytes) 0 flags [none] length: 1498 10.0.17.1 &gt; 10.0.24.1) ns3::TcpHeader (49153 &gt; 7010 [ACK] Seq=1441 Ack=1 Win=65535 ns3::TcpOptionTS(1008;1007) ns3::TcpOptionEnd(EOL)) Payload (size=1440) Payload Fragment [0:6]" tId="25" fbRx="1.009230382" lbRx="1.010430381" />
<p fId="25" fbTx="1.010430381" lbTx="1.01163038" meta-info="ns3::PppHeader (Point-to-Point Protocol: IP (0x0021)) ns3::Ipv4Header (tos 0x0 DSCP Default ECN Not-ECT ttl 62 id 3 protocol 6 offset (bytes) 0 flags [none] length: 1498 10.0.17.1 &gt; 10.0.24.1) ns3::TcpHeader (49153 &gt; 7010 [ACK] Seq=1441 Ack=1 Win=65535 ns3::TcpOptionTS(1008;1007) ns3::TcpOptionEnd(EOL)) Payload (size=1440) Payload Fragment [0:6]" tId="34" fbRx="1.010430381" lbRx="1.01163038" />
<p fId="34" fbTx="1.01163038" lbTx="1.012830379" meta-info="ns3::PppHeader (Point-to-Point Protocol: IP (0x0021)) ns3::Ipv4Header (tos 0x0 DSCP Default ECN Not-ECT ttl 61 id 3 protocol 6 offset (bytes) 0 flags [none] length: 1498 10.0.17.1 &gt; 10.0.24.1) ns3::TcpHeader (49153 &gt; 7010 [ACK] Seq=1441 Ack=1 Win=65535 ns3::TcpOptionTS(1008;1007) ns3::TcpOptionEnd(EOL)) Payload (size=1440) Payload Fragment [0:6]" tId="27" fbRx="1.01163038" lbRx="1.012830379" />
<p fId="27" fbTx="1.012830379" lbTx="1.014030378" meta-info="ns3::PppHeader (Point-to-Point Protocol: IP (0x0021)) ns3::Ipv4Header (tos 0x0 DSCP Default ECN Not-ECT ttl 60 id 3 protocol 6 offset (bytes) 0 flags [none] length: 1498 10.0.17.1 &gt; 10.0.24.1) ns3::TcpHeader (49153 &gt; 7010 [ACK] Seq=1441 Ack=1 Win=65535 ns3::TcpOptionTS(1008;1007) ns3::TcpOptionEnd(EOL)) Payload (size=1440) Payload Fragment [0:6]" tId="18" fbRx="1.012830379" lbRx="1.014030378" />
<p fId="18" fbTx="1.014030378" lbTx="1.015230377" meta-info="ns3::PppHeader (Point-to-Point Protocol: IP (0x0021)) ns3::Ipv4Header (tos 0x0 DSCP Default ECN Not-ECT ttl 59 id 3 protocol 6 offset (bytes) 0 flags [none] length: 1498 10.0.17.1 &gt; 10.0.24.1) ns3::TcpHeader (49153 &gt; 7010 [ACK] Seq=1441 Ack=1 Win=65535 ns3::TcpOptionTS(1008;1007) ns3::TcpOptionEnd(EOL)) Payload (size=1440) Payload Fragment [0:6]" tId="4" fbRx="1.014030378" lbRx="1.015230377" />
<p fId="4" fbTx="1.215230377" lbTx="1.215273577" meta-info="ns3::PppHeader (Point-to-Point Protocol: IP (0x0021)) ns3::Ipv4Header (tos 0x0 DSCP Default ECN Not-ECT ttl 64 id 2 protocol 6 offset (bytes) 0 flags [none] length: 52 10.0.24.1 &gt; 10.0.17.1) ns3::TcpHeader (7010 &gt; 49153 [ACK] Seq=1 Ack=2887 Win=65535 ns3::TcpOptionTS(1215;1008) ns3::TcpOptionEnd(EOL))" tId="18" fbRx="1.215230377" lbRx="1.215273577" />
<p fId="18" fbTx="1.215273577" lbTx="1.215316777" meta-info="ns3::PppHeader (Point-to-Point Protocol: IP (0x0021)) ns3::Ipv4Header (tos 0x0 DSCP Default ECN Not-ECT ttl 63 id 2 protocol 6 offset (bytes) 0 flags [none] length: 52 10.0.24.1 &gt; 10.0.17.1) ns3::TcpHeader (7010 &gt; 49153 [ACK] Seq=1 Ack=2887 Win=65535 ns3::TcpOptionTS(1215;1008) ns3::TcpOptionEnd(EOL))" tId="26" fbRx="1.215273577" lbRx="1.215316777" />
<p fId="26" fbTx="1.215316777" lbTx="1.215359977" meta-info="ns3::PppHeader (Point-to-Point Protocol: IP (0x0021)) ns3::Ipv4Header (tos 0x0 DSCP Default ECN Not-ECT ttl 62 id 2 protocol 6 offset (bytes) 0 flags [none] length: 52 10.0.24.1 &gt; 10.0.17.1) ns3::TcpHeader (7010 &gt; 49153 [ACK] Seq=1 Ack=2887 Win=65535 ns3::TcpOptionTS(1215;1008) ns3::TcpOptionEnd(EOL))" tId="32" fbRx="1.215316777" lbRx="1.215359977" />
<p fId="32" fbTx="1.215359977" lbTx="1.215403177" meta-info="ns3::PppHeader (Point-to-Point Protocol: IP (0x0021)) ns3::Ipv4Header (tos 0x0 DSCP Default ECN Not-ECT ttl 61 id 2 protocol 6 offset (bytes) 0 flags [none] length: 52 10.0.24.1 &gt; 10.0.17.1) ns3::TcpHeader (7010 &gt; 49153 [ACK] Seq=1 Ack=2887 Win=65535 ns3::TcpOptionTS(1215;1008) ns3::TcpOptionEnd(EOL))" tId="24" fbRx="1.215359977" lbRx="1.215403177" />
<p fId="24" fbTx="1.215403177" lbTx="1.215446377" meta-info="ns3::PppHeader (Point-to-Point Protocol: IP (0x0021)) ns3::Ipv4Header (tos 0x0 DSCP Default ECN Not-ECT ttl 60 id 2 protocol 6 offset (bytes) 0 flags [none] length: 52 10.0.24.1 &gt; 10.0.17.1) ns3::TcpHeader (7010 &gt; 49153 [ACK] Seq=1 Ack=2887 Win=65535 ns3::TcpOptionTS(1215;1008) ns3::TcpOptionEnd(EOL))" tId="16" fbRx="1.215403177" lbRx="1.215446377" />
<p fId="16" fbTx="1.215446377" lbTx="1.215489577" meta-info="ns3::PppHeader (Point-to-Point Protocol: IP (0x0021)) ns3::Ipv4Header (tos 0x0 DSCP Default ECN Not-ECT ttl 59 id 2 protocol 6 offset (bytes) 0 flags [none] length: 52 10.0.24.1 &gt; 10.0.17.1) ns3::TcpHeader (7010 &gt; 49153 [ACK] Seq=1 Ack=2887 Win=65535 ns3::TcpOptionTS(1215;1008) ns3::TcpOptionEnd(EOL))" tId="0" fbRx="1.215446377" lbRx="1.215489577" />
<p fId="0" fbTx="1.215489578" lbTx="1.216689577" meta-info="ns3::PppHeader (Point-to-Point Protocol: IP (0x0021)) ns3::Ipv4Header (tos 0x0 DSCP Default ECN Not-ECT ttl 64 id 4 protocol 6 offset (bytes) 0 flags [none] length: 1498 10.0.17.1 &gt; 10.0.24.1) ns3::TcpHeader (49153 &gt; 7010 [ACK] Seq=2887 Ack=1 Win=65535 ns3::TcpOptionTS(1215;1215) ns3::TcpOptionEnd(EOL)) Payload Fragment [6:1440] Payload Fragment [0:12]" tId="16" fbRx="1.215489578" lbRx="1.216689577" />
<p fId="0" fbTx="1.216689577" lbTx="1.217889576" meta-info="ns3::PppHeader (Point-to-Point Protocol: IP (0x0021)) ns3::Ipv4Header (tos 0x0 DSCP Default ECN Not-ECT ttl 64 id 5 protocol 6 offset (bytes) 0 flags [none] length: 1498 10.0.17.1 &gt; 10.0.24.1) ns3::TcpHeader (49153 &gt; 7010 [ACK] Seq=4333 Ack=1 Win=65535 ns3::TcpOptionTS(1215;1215) ns3::TcpOptionEnd(EOL)) Payload Fragment [12:1440] Payload Fragment [0:18]" tId="16" fbRx="1.216689577" lbRx="1.217889576" />
<p fId="16" fbTx="1.216689577" lbTx="1.217889576" meta-info="ns3::PppHeader (Point-to-Point Protocol: IP (0x0021)) ns3::Ipv4Header (tos 0x0 DSCP Default ECN Not-ECT ttl 63 id 4 protocol 6 offset (bytes) 0 flags [none] length: 1498 10.0.17.1 &gt; 10.0.24.1) ns3::TcpHeader (49153 &gt; 7010 [ACK] Seq=2887 Ack=1 Win=65535 ns3::TcpOptionTS(1215;1215) ns3::TcpOptionEnd(EOL)) Payload Fragment [6:1440] Payload Fragment [0:12]" tId="24" fbRx="1.216689577" lbRx="1.217889576" />
<p fId="16" fbTx="1.217889576" lbTx="1.219089575" meta-info="ns3::PppHeader (Point-to-Point Protocol: IP (0x0021)) ns3::Ipv4Header (tos 0x0 DSCP Default ECN Not-ECT ttl 63 id 5 protocol 6 offset (bytes) 0 flags [none] length: 1498 10.0.17.1 &gt; 10.0.24.1) ns3::TcpHeader (49153 &gt; 7010 [ACK] Seq=4333 Ack=1 Win=65535 ns3::TcpOptionTS(1215;1215) ns3::TcpOptionEnd(EOL)) Payload Fragment [12:1440] Payload Fragment [0:18]" tId="24" fbRx="1.217889576" lbRx="1.219089575" />
<p fId="24" fbTx="1.217889576" lbTx="1.219089575" meta-info="ns3::PppHeader (Point-to-Point Protocol: IP (0x0021)) ns3::Ipv4Header (tos 0x0 DSCP Default ECN Not-ECT ttl 62 id 4 protocol 6 offset (bytes) 0 flags [none] length: 1498 10.0.17.1 &gt; 10.0.24.1) ns3::TcpHeader (49153 &gt; 7010 [ACK] Seq=2887 Ack=1 Win=65535 ns3::TcpOptionTS(1215;1215) ns3::TcpOptionEnd(EOL)) Payload Fragment [6:1440] Payload Fragment [0:12]" tId="33" fbRx="1.217889576" lbRx="1.219089575" />
<p fId="24" fbTx="1.219089575" lbTx="1.220289574" meta-info="ns3::PppHeader (Point-to-Point Protocol: IP (0x0021)) ns3::Ipv4Header (tos 0x0 DSCP Default ECN Not-ECT ttl 62 id 5 protocol 6 offset (bytes) 0 flags [none] length: 1498 10.0.17.1 &gt; 10.0.24.1) ns3::TcpHeader (49153 &gt; 7010 [ACK] Seq=4333 Ack=1 Win=65535 ns3::TcpOptionTS(1215;1215) ns3::TcpOptionEnd(EOL)) Payload Fragment [12:1440] Payload Fragment [0:18]" tId="33" fbRx="1.219089575" lbRx="1.220289574" />
<p fId="33" fbTx="1.219089575" lbTx="1.220289574" meta-info="ns3::PppHeader (Point-to-Point Protocol: IP (0x0021)) ns3::Ipv4Header (tos 0x0 DSCP Default ECN Not-ECT ttl 61 id 4 protocol 6 offset (bytes) 0 flags [none] length: 1498 10.0.17.1 &gt; 10.0.24.1) ns3::TcpHeader (49153 &gt; 7010 [ACK] Seq=2887 Ack=1 Win=65535 ns3::TcpOptionTS(1215;1215) ns3::TcpOptionEnd(EOL)) Payload Fragment [6:1440] Payload Fragment [0:12]" tId="26" fbRx="1.219089575" lbRx="1.220289574" />
<p fId="33" fbTx="1.220289574" lbTx="1.221489573" meta-info="ns3::PppHeader (Point-to-Point Protocol: IP (0x0021)) ns3::Ipv4Header (tos 0x0 DSCP Default ECN Not-ECT ttl 61 id 5 protocol 6 offset (bytes) 0 flags [none] length: 1498 10.0.17.1 &gt; 10.0.24.1) ns3::TcpHeader (49153 &gt; 7010 [ACK] Seq=4333 Ack=1 Win=65535 ns3::TcpOptionTS(1215;1215) ns3::TcpOptionEnd(EOL)) Payload Fragment [12:1440] Payload Fragment [0:18]" tId="26" fbRx="1.220289574" lbRx="1.221489573" />
<p fId="26" fbTx="1.220289574" lbTx="1.221489573" meta-info="ns3::PppHeader (Point-to-Point Protocol: IP (0x0021)) ns3::Ipv4Header (tos 0x0 DSCP Default ECN Not-ECT ttl 60 id 4 protocol 6 offset (bytes) 0 flags [none] length: 1498 10.0.17.1 &gt; 10.0.24.1) ns3::TcpHeader (49153 &gt; 7010 [ACK] Seq=2887 Ack=1 Win=65535 ns3::TcpOptionTS(1215;1215) ns3::TcpOptionEnd(EOL)) Payload Fragment [6:1440] Payload Fragment [0:12]" tId="18" fbRx="1.220289574" lbRx="1.221489573" />
<p fId="26" fbTx="1.221489573" lbTx="1.222689572" meta-info="ns3::PppHeader (Point-to-Point Protocol: IP (0x0021)) ns3::Ipv4Header (tos 0x0 DSCP Default ECN Not-ECT ttl 60 id 5 protocol 6 offset (bytes) 0 flags [none] length: 1498 10.0.17.1 &gt; 10.0.24.1) ns3::TcpHeader (49153 &gt; 7010 [ACK] Seq=4333 Ack=1 Win=65535 ns3::TcpOptionTS(1215;1215) ns3::TcpOptionEnd(EOL)) Payload Fragment [12:1440] Payload Fragment [0:18]" tId="18" fbRx="1.221489573" lbRx="1.222689572" />
<p fId="18" fbTx="1.221489573" lbTx="1.222689572" meta-info="ns3::PppHeader (Point-to-Point Protocol: IP (0x0021)) ns3::Ipv4Header (tos 0x0 DSCP Default ECN Not-ECT ttl 59 id 4 protocol 6 offset (bytes) 0 flags [none] length: 1498 10.0.17.1 &gt; 10.0.24.1) ns3::TcpHeader (49153 &gt; 7010 [ACK] Seq=2887 Ack=1 Win=65535 ns3::TcpOptionTS(1215;1215) ns3::TcpOptionEnd(EOL)) Payload Fragment [6:1440] Payload Fragment [0:12]" tId="4" fbRx="1.221489573" lbRx="1.222689572" />
<p fId="18" fbTx="1.222689572" lbTx="1.223889571" meta-info="ns3::PppHeader (Point-to-Point Protocol: IP (0x0021)) ns3::Ipv4Header (tos 0x0 DSCP Default ECN Not-ECT ttl 59 id 5 protocol 6 offset (bytes) 0 flags [none] length: 1498 10.0.17.1 &gt; 10.0.24.1) ns3::TcpHeader (49153 &gt; 7010 [ACK] Seq=4333 Ack=1 Win=65535 ns3::TcpOptionTS(1215;1215) ns3::TcpOptionEnd(EOL)) Payload Fragment [12:1440] Payload Fragment [0:18]" tId="4" fbRx="1.222689572" lbRx="1.223889571" />
<p fId="4" fbTx="1.223889571" lbTx="1.223932771" meta-info="ns3::PppHeader (Point-to-Point Protocol: IP (0x0021)) ns3::Ipv4Header (tos 0x0 DSCP Default ECN Not-ECT ttl 64 id 3 protocol 6 offset (bytes) 0 flags [none] length: 52 10.0.24.1 &gt; 10.0.17.1) ns3::TcpHeader (7010 &gt; 49153 [ACK] Seq=1 Ack=5779 Win=65535 ns3::TcpOptionTS(1223;1215) ns3::TcpOptionEnd(EOL))" tId="18" fbRx="1.223889571" lbRx="1.223932771" />
<p fId="18" fbTx="1.223932771" lbTx="1.223975971" meta-info="ns3::PppHeader (Point-to-Point Protocol: IP (0x0021)) ns3::Ipv4Header (tos 0x0 DSCP Default ECN Not-ECT ttl 63 id 3 protocol 6 offset (bytes) 0 flags [none] length: 52 10.0.24.1 &gt; 10.0.17.1) ns3::TcpHeader (7010 &gt; 49153 [ACK] Seq=1 Ack=5779 Win=65535 ns3::TcpOptionTS(1223;1215) ns3::TcpOptionEnd(EOL))" tId="26" fbRx="1.223932771" lbRx="1.223975971" />
<p fId="26" fbTx="1.223975971" lbTx="1.224019171" meta-info="ns3::PppHeader (Point-to-Point Protocol: IP (0x0021)) ns3::Ipv4Header (tos 0x0 DSCP Default ECN Not-ECT ttl 62 id 3 protocol 6 offset (bytes) 0 flags [none] length: 52 10.0.24.1 &gt; 10.0.17.1) ns3::TcpHeader (7010 &gt; 49153 [ACK] Seq=1 Ack=5779 Win=65535 ns3::TcpOptionTS(1223;1215) ns3::TcpOptionEnd(EOL))" tId="32" fbRx="1.223975971" lbRx="1.224019171" />
<p fId="32" fbTx="1.224019171" lbTx="1.224062371" meta-info="ns3::PppHeader (Point-to-Point Protocol: IP (0x0021)) ns3::Ipv4Header (tos 0x0 DSCP Default ECN Not-ECT ttl 61 id 3 protocol 6 offset (bytes) 0 flags [none] length: 52 10.0.24.1 &gt; 10.0.17.1) ns3::TcpHeader (7010 &gt; 49153 [ACK] Seq=1 Ack=5779 Win=65535 ns3::TcpOptionTS(1223;1215) ns3::TcpOptionEnd(EOL))" tId="24" fbRx="1.224019171" lbRx="1.224062371" />
<p fId="24" fbTx="1.224062371" lbTx="1.224105571" meta-info="ns3::PppHeader (Point-to-Point Protocol: IP (0x0021)) ns3::Ipv4Header (tos 0x0 DSCP Default ECN Not-ECT ttl 60 id 3 protocol 6 offset (bytes) 0 flags [none] length: 52 10.0.24.1 &gt; 10.0.17.1) ns3::TcpHeader (7010 &gt; 49153 [ACK] Seq=1 Ack=5779 Win=65535 ns3::TcpOptionTS(1223;1215) ns3::TcpOptionEnd(EOL))" tId="16" fbRx="1.224062371" lbRx="1.224105571" />
<p fId="16" fbTx="1.224105571" lbTx="1.224148771" meta-info="ns3::PppHeader (Point-to-Point Protocol: IP (0x0021)) ns3::Ipv4Header (tos 0x0 DSCP Default ECN Not-ECT ttl 59 id 3 protocol 6 offset (bytes) 0 flags [none] length: 52 10.0.24.1 &gt; 10.0.17.1) ns3::TcpHeader (7010 &gt; 49153 [ACK] Seq=1 Ack=5779 Win=65535 ns3::TcpOptionTS(1223;1215) ns3::TcpOptionEnd(EOL))" tId="0" fbRx="1.224105571" lbRx="1.224148771" />
<p fId="0" fbTx="1.224148772" lbTx="1.225348771" meta-info="ns3::PppHeader (Point-to-Point Protocol: IP (0x0021)) ns3::Ipv4Header (tos 0x0 DSCP Default ECN Not-ECT ttl 64 id 6 protocol 6 offset (bytes) 0 flags [none] length: 1498 10.0.17.1 &gt; 10.0.24.1) ns3::TcpHeader (49153 &gt; 7010 [ACK] Seq=5779 Ack=1 Win=65535 ns3::TcpOptionTS(1224;1223) ns3::TcpOptionEnd(EOL)) Payload Fragment [18:1440] Payload Fragment [0:24]" tId="16" fbRx="1.224148772" lbRx="1.225348771" />
<p fId="0" fbTx="1.225348771" lbTx="1.22654877" meta-info="ns3::PppHeader (Point-to-Point Protocol: IP (0x0021)) ns3::Ipv4Header (tos 0x0 DSCP Default ECN Not-ECT ttl 64 id 7 protocol 6 offset (bytes) 0 flags [none] length: 1498 10.0.17.1 &gt; 10.0.24.1) ns3::TcpHeader (49153 &gt; 7010 [ACK] Seq=7225 Ack=1 Win=65535 ns3::TcpOptionTS(1224;1223) ns3::TcpOptionEnd(EOL)) Payload Fragment [24:1440] Payload Fragment [0:30]" tId="16" fbRx="1.225348771" lbRx="1.22654877" />
